Task ID,App,Type,Issue #,Input Combo,Issue Description,WCAG Criterion,Severity,Manually Observed,Emulator Artifact,Verified on Real Device,Claude (Events),Claude (Trees),Claude (Events + User Actions),Claude (Events + User Actions + Trees),Codex (Events),Codex (Trees),Codex (Events + User Actions),Codex (Events + User Actions + Trees),Notes
GM1,Gmail,Core,1,Events only,Search result item receives <no_feedback> when re-focused after opening email,"1.1.1 Non-text Content (A); 4.1.2 Name, Role, Value (A)",High,Y,N,,Y,,Y,Y,,,,,event_seq 37: announcement ['<no_feedback>'] on viewified_conversation_item_view; label: '' after email was opened and focus returned to list
GM1,Gmail,Core,2,Events only,Search bar announces label twice — 'Search in mail, Search in mail',"4.1.2 Name, Role, Value (A)",Medium,Y,N,,Y,Y,Y,Y,,,,,event_seq 12-13: announcement ['Search in mail, Search in mail', 'Double-tap to activate']; root cause: open_search EditText has text='Search in mail' and hint='Search in mail' with empty contentDescription
GM1,Gmail,Core,3,Events only,"Email list item announcement contains empty gaps — 'Unread, , , Google, , Security alert…'","1.1.1 Non-text Content (A)",Medium,Y,N,,Y,Y,Y,Y,,,,,event_seq 35: announcement ['Unread, , , Google, , Security alert, to your Google Account on a Android device. If this was you, you don't need to do anything. If not, we'll help you secure, ,  at 1:12 AM, labels: Inbox, , 5 of 9, In list, 9 items, Window Mail']; empty slots from child elements with no text alternative
GM1,Gmail,Core,4,Events only,Email content entirely inaccessible via TalkBack after opening,"2.1.1 Keyboard (A)",High,Y,N,,Y,Y,Y,Y,,,,,event_seq 35→37: 79-second gap with no focus events inside email; user_actions seq 49-73 show 87s of failed navigation; no tree captured for email body; TalkBack could not read subject/sender/body
GM1,Gmail,Core,5,Events only,"Onboarding buttons 'GOT IT' and 'TAKE ME TO GMAIL' implemented as TextView — role not announced","4.1.2 Name, Role, Value (A)",Low,N,N,,Y,Y,Y,Y,,,,,event_seq 4: announcement ['GOT IT', 'Double-tap to activate'] — no button role; event_seq 7: ['TAKE ME TO GMAIL', 'Double-tap to activate']; tree confirms className='android.widget.TextView' with no roleDescription on welcome_tour_got_it
GM1,Gmail,Core,6,Trees only,Search suggestion containers are focusable LinearLayouts with no accessible role,"4.1.2 Name, Role, Value (A)",Low,N,N,,,Y,,Y,,,,,tree_2026-05-26T08-18-32-712.json: search_suggestion_item_view className='android.widget.LinearLayout'; contentDescription=''; isFocusable=true; isClickable=true; no roleDescription — name derived from child text only; user did not navigate suggestions via TalkBack swipe
